<linker xmlns:xsi="http://www.w3.org/2001/XMLSchema-instance" xsi:schemaLocation="https://www.w3schools.com ..\..\..\src\ILLink.Shared\ILLink.LinkAttributes.xsd">
  <assembly fullname="test, Version=0.0.0.0, Culture=neutral, PublicKeyToken=null">
    <type fullname="Mono.Linker.Tests.Cases.UnreachableBlock.InstanceMethodSubstitutions">
      <method signature="System.Boolean IsEnabled()" body="stub" value="false">
      </method>
    </type>
    <type fullname="Mono.Linker.Tests.Cases.UnreachableBlock.InstanceMethodSubstitutions/TestVirtualMethodBase">
      <method signature="System.Boolean IsEnabled()" body="stub" value="true">
      </method>
    </type>
    <type fullname="Mono.Linker.Tests.Cases.UnreachableBlock.InstanceMethodSubstitutions/TestVirtualMethodType">
      <method signature="System.Boolean IsEnabled()" body="stub" value="true">
      </method>
    </type>
  </assembly>
</linker>
