<?xml version="1.0" encoding="utf-8" ?>
<linker xmlns:xsi="http://www.w3.org/2001/XMLSchema-instance" xsi:schemaLocation="https://www.w3schools.com ..\..\..\src\ILLink.Shared\ILLink.LinkAttributes.xsd">
  <assembly fullname="test">
    <type fullname="Mono.Linker.Tests.Cases.LinkAttributes.TestConditionalRemoveAttribute">
      <attribute internal="RemoveAttributeInstances">
        <argument type="System.Object">
          <argument>remove1</argument>
        </argument>
      </attribute>
    </type>
    <type fullname="Mono.Linker.Tests.Cases.LinkAttributes.TestConditionalRemoveAttribute">
      <attribute internal="RemoveAttributeInstances">
        <argument type="System.Object">
          <argument type="System.Int32">100</argument>
        </argument>
      </attribute>
    </type>
    <type fullname="Mono.Linker.Tests.Cases.LinkAttributes.TestConditionalRemoveAttribute">
      <attribute internal="RemoveAttributeInstances">
        <argument type="System.Object">
          <argument>remove0</argument>
        </argument>
      </attribute>
    </type>
  </assembly>
</linker>
